{
  "topic": "frogs",
  "slug": "frogs",
  "targetAge": 5,
  "sources": [
    {
      "title": "Frog - Wikipedia",
      "url": "https://en.wikipedia.org/wiki/Frog",
      "accessed": "2026-05-02",
      "notes": "Primary overview source for frog body, habitats, life cycle, calls, and conservation."
    },
    {
      "title": "Tadpole - Wikipedia",
      "url": "https://en.wikipedia.org/wiki/Tadpole",
      "accessed": "2026-05-02",
      "notes": "Used to cross-check tadpole features and metamorphosis details."
    },
    {
      "title": "Tree frog - Wikipedia",
      "url": "https://en.wikipedia.org/wiki/Tree_frog",
      "accessed": "2026-05-02",
      "notes": "Used to support simple facts about tree frogs living in trees and sticky toe pads."
    },
    {
      "title": "File:Red-eyed Leaf Frog (49661076226).jpg - Wikimedia Commons",
      "url": "https://commons.wikimedia.org/wiki/File:Red-eyed_Leaf_Frog_(49661076226).jpg",
      "accessed": "2026-05-02",
      "notes": "Candidate image metadata and attribution."
    },
    {
      "title": "File:RanaTemporariaLarva2.jpg - Wikimedia Commons",
      "url": "https://commons.wikimedia.org/wiki/File:RanaTemporariaLarva2.jpg",
      "accessed": "2026-05-02",
      "notes": "Candidate image metadata and attribution."
    },
    {
      "title": "File:Laubfrosch cropped.jpg - Wikimedia Commons",
      "url": "https://commons.wikimedia.org/wiki/File:Laubfrosch_cropped.jpg",
      "accessed": "2026-05-02",
      "notes": "Candidate image metadata and attribution."
    },
    {
      "title": "File:Hyla cinerea (American Green Tree Frog).jpg - Wikimedia Commons",
      "url": "https://commons.wikimedia.org/wiki/File:Hyla_cinerea_(American_Green_Tree_Frog).jpg",
      "accessed": "2026-05-02",
      "notes": "Candidate image metadata and attribution."
    },
    {
      "title": "File:Frog spawn.jpg - Wikimedia Commons",
      "url": "https://commons.wikimedia.org/wiki/File:Frog_spawn.jpg",
      "accessed": "2026-05-02",
      "notes": "Candidate image metadata and attribution."
    },
    {
      "title": "File:Gray Tree Frog (Hyla versicolor) (8716723960).jpg - Wikimedia Commons",
      "url": "https://commons.wikimedia.org/wiki/File:Gray_Tree_Frog_(Hyla_versicolor)_(8716723960).jpg",
      "accessed": "2026-05-02",
      "notes": "Candidate image metadata and attribution."
    }
  ],
  "facts": [
    {
      "category": "what-they-are",
      "text": "Frogs are amphibians.",
      "source": 0
    },
    {
      "category": "what-they-are",
      "text": "Adult frogs do not have tails.",
      "source": 0
    },
    {
      "category": "body",
      "text": "Many frogs have big eyes and strong back legs.",
      "source": 0
    },
    {
      "category": "movement",
      "text": "Many frogs jump, and many can swim too.",
      "source": 0
    },
    {
      "category": "skin",
      "text": "Frog skin can be smooth, bumpy, bright, or camouflaged.",
      "source": 0
    },
    {
      "category": "habitat",
      "text": "Frogs live in many places around the world.",
      "source": 0
    },
    {
      "category": "habitat",
      "text": "Many frogs stay near fresh water or other damp places.",
      "source": 0
    },
    {
      "category": "tree-frogs",
      "text": "Some frogs live in trees.",
      "source": 2
    },
    {
      "category": "tree-frogs",
      "text": "Tree frogs often have sticky toe pads that help them hold on.",
      "source": 2
    },
    {
      "category": "sounds",
      "text": "Frogs make calls, especially during breeding season.",
      "source": 0
    },
    {
      "category": "food",
      "text": "Adult frogs often eat small animals such as insects.",
      "source": 0
    },
    {
      "category": "life-cycle",
      "text": "Many frogs lay their eggs in water.",
      "source": 0
    },
    {
      "category": "life-cycle",
      "text": "Frog eggs are often called frogspawn.",
      "source": 0
    },
    {
      "category": "life-cycle",
      "text": "The eggs hatch into tadpoles.",
      "source": 0
    },
    {
      "category": "tadpoles",
      "text": "Tadpoles live in water.",
      "source": 1
    },
    {
      "category": "tadpoles",
      "text": "Tadpoles have tails for swimming.",
      "source": 1
    },
    {
      "category": "tadpoles",
      "text": "As tadpoles grow, they begin to grow legs.",
      "source": 1
    },
    {
      "category": "metamorphosis",
      "text": "A tadpole changes into a frog in a process called metamorphosis.",
      "source": 0
    },
    {
      "category": "metamorphosis",
      "text": "During this change, the tail shrinks and lungs develop.",
      "source": 1
    },
    {
      "category": "variety",
      "text": "There are thousands of frog species.",
      "source": 0
    },
    {
      "category": "variety",
      "text": "Some frogs are tiny, and some are much bigger.",
      "source": 2
    },
    {
      "category": "safety",
      "text": "Some frogs use bright colors to warn other animals to leave them alone.",
      "source": 0
    },
    {
      "category": "importance",
      "text": "Frogs are an important part of food webs.",
      "source": 0
    },
    {
      "category": "conservation",
      "text": "Many frog species are in trouble and need safe places to live.",
      "source": 0
    }
  ],
  "images": [
    {
      "filename": "images/red-eyed-leaf-frog.jpg",
      "description": "Red-eyed leaf frog on a green leaf in Costa Rica.",
      "source_url": "https://commons.wikimedia.org/wiki/File:Red-eyed_Leaf_Frog_(49661076226).jpg",
      "author": "Charlie Jackson",
      "license": "CC BY 2.0",
      "license_url": "https://creativecommons.org/licenses/by/2.0/"
    },
    {
      "filename": "images/tadpole-rana-temporaria.jpg",
      "description": "Common frog tadpole just before metamorphosis.",
      "source_url": "https://commons.wikimedia.org/wiki/File:RanaTemporariaLarva2.jpg",
      "author": "Viridiflavus",
      "license": "CC BY-SA 3.0",
      "license_url": "https://creativecommons.org/licenses/by-sa/3.0/"
    },
    {
      "filename": "images/european-tree-frog.jpg",
      "description": "European tree frog clinging to a plant.",
      "source_url": "https://commons.wikimedia.org/wiki/File:Laubfrosch_cropped.jpg",
      "author": "Christoph Leeb",
      "license": "CC BY-SA 3.0",
      "license_url": "https://creativecommons.org/licenses/by-sa/3.0/"
    },
    {
      "filename": "images/american-green-tree-frog.jpg",
      "description": "American green tree frog close-up.",
      "source_url": "https://commons.wikimedia.org/wiki/File:Hyla_cinerea_(American_Green_Tree_Frog).jpg",
      "author": "Slimmdiggity",
      "license": "CC BY-SA 4.0",
      "license_url": "https://creativecommons.org/licenses/by-sa/4.0/"
    },
    {
      "filename": "images/frog-spawn.jpg",
      "description": "Frog spawn in shallow water.",
      "source_url": "https://commons.wikimedia.org/wiki/File:Frog_spawn.jpg",
      "author": "Tiia Monto",
      "license": "CC BY-SA 3.0",
      "license_url": "https://creativecommons.org/licenses/by-sa/3.0/"
    },
    {
      "filename": "images/gray-tree-frog.jpg",
      "description": "Gray tree frog resting on bark in Missouri.",
      "source_url": "https://commons.wikimedia.org/wiki/File:Gray_Tree_Frog_(Hyla_versicolor)_(8716723960).jpg",
      "author": "Peter Paplanus",
      "license": "CC BY 2.0",
      "license_url": "https://creativecommons.org/licenses/by/2.0/"
    },
    {
      "filename": "images/a-green-tree-frog-on-a-lily-pad-watercolor-illustration.png",
      "description": "A green tree frog on a lily pad, watercolor illustration",
      "source_url": "Generated via OpenAI Images API",
      "author": "OpenAI gpt-image-1",
      "license": "Generated (non-redistributable without rights)",
      "license_url": "https://openai.com/policies/terms-of-use"
    },
    {
      "filename": "images/a-photo-realistic-close-up-of-a-tadpole-swimming-in-clear-sh.png",
      "description": "A photo realistic close-up of a tadpole swimming in clear shallow water, showing its developing legs and translucent tail",
      "source_url": "Generated via OpenAI Images API",
      "author": "OpenAI gpt-image-2",
      "license": "Generated (non-redistributable without rights)",
      "license_url": "https://openai.com/policies/terms-of-use"
    }
  ]
}
