{
  "topic": "frogs",
  "slug": "frogs",
  "targetAge": 5,
  "sources": [
    {
      "title": "Frog",
      "url": "https://en.wikipedia.org/wiki/Frog",
      "accessed": "2026-05-02",
      "notes": "Primary overview for frog traits, life cycle, habitat, and diversity."
    },
    {
      "title": "Amphibian",
      "url": "https://en.wikipedia.org/wiki/Amphibian",
      "accessed": "2026-05-02",
      "notes": "Used to support broad amphibian context."
    },
    {
      "title": "Poison dart frog",
      "url": "https://en.wikipedia.org/wiki/Poison_dart_frog",
      "accessed": "2026-05-02",
      "notes": "Used for bright-color example and caution about species variation."
    }
  ],
  "facts": [
    {
      "category": "body",
      "text": "Frogs are amphibians.",
      "source": 0
    },
    {
      "category": "body",
      "text": "Most frogs have strong back legs for jumping.",
      "source": 0
    },
    {
      "category": "habitat",
      "text": "Many frogs live in damp places near ponds, streams, or wetlands.",
      "source": 0
    },
    {
      "category": "life-cycle",
      "text": "Frogs begin life as eggs, then tadpoles, and later grow legs.",
      "source": 0
    },
    {
      "category": "diet",
      "text": "Many adult frogs eat insects and other small animals.",
      "source": 0
    },
    {
      "category": "senses",
      "text": "A frog's eyes and ears help it watch and listen while staying partly hidden.",
      "source": 0
    },
    {
      "category": "skin",
      "text": "Frogs do not all look the same. Their colors and patterns can be very different.",
      "source": 2
    },
    {
      "category": "diversity",
      "text": "There are thousands of frog species around the world.",
      "source": 0
    },
    {
      "category": "movement",
      "text": "Some frogs are good swimmers, and some can climb.",
      "source": 0
    },
    {
      "category": "sound",
      "text": "Many frogs make calls, and the sounds can help them find mates or warn others.",
      "source": 0
    }
  ],
  "images": [
    {
      "filename": "images/red-eyed-tree-frog.jpg",
      "description": "A red-eyed tree frog resting on a green leaf.",
      "source_url": "https://commons.wikimedia.org/wiki/File:Red_eyed_tree_frog_edit2.jpg",
      "author": "Carey James Balboa",
      "license": "CC BY-SA 3.0",
      "license_url": "https://creativecommons.org/licenses/by-sa/3.0/"
    },
    {
      "filename": "images/poison-dart-frog.jpg",
      "description": "A bright poison dart frog on the forest floor.",
      "source_url": "https://commons.wikimedia.org/wiki/File:Dendrobates_pumilio_-_Blue_jeans_frog.jpg",
      "author": "Brian Gratwicke",
      "license": "CC BY 2.0",
      "license_url": "https://creativecommons.org/licenses/by/2.0/"
    },
    {
      "filename": "images/frogspawn.jpg",
      "description": "Clusters of frog eggs floating in shallow water.",
      "source_url": "https://commons.wikimedia.org/wiki/File:Frog_spawn.jpg",
      "author": "Mikko Paananen",
      "license": "CC BY-SA 3.0",
      "license_url": "https://creativecommons.org/licenses/by-sa/3.0/"
    },
    {
      "filename": "images/tadpole.jpg",
      "description": "A dark tadpole swimming in water.",
      "source_url": "https://commons.wikimedia.org/wiki/File:Tadpole_(aka).jpg",
      "author": "Mdf",
      "license": "CC BY-SA 3.0",
      "license_url": "https://creativecommons.org/licenses/by-sa/3.0/"
    },
    {
      "filename": "images/frog-pond.jpg",
      "description": "A calm pond with reeds and lily pads.",
      "source_url": "https://commons.wikimedia.org/wiki/File:Pond_in_Bialowieza_Forest.jpg",
      "author": "Wojciech Puchta",
      "license": "CC BY-SA 4.0",
      "license_url": "https://creativecommons.org/licenses/by-sa/4.0/"
    }
  ]
}
